name ,mood,year,artist,lyrics
Jabili Kosam-Male,Sad,1992,S.P.Balasubramanyam,జాబిల్లి కోసం.. ఆకాశమల్లే.. వేచాను నీ రాకకై జాబిల్లి కోసం.. ఆకాశమల్లే.. వేచాను నీ రాకకై జాబిల్లి కోసం.. ఆకాశమల్లే.. వేచాను నీ రాకకై జాబిల్లి కోసం.. ఆకాశమల్లే.. వేచాను నీ రాకకై నిను కాన లేకా.. మనసూరుకోకా.. పాడాను నేనూ పాటనై జాబిల్లి కోసం.. ఆకాశమల్లే.. వేచాను నీ రాకకై నువ్వక్కడ.. నేనిక్కడ పాటిక్కడ.. పలుకక్కడ మనసొక్కటి కలిసున్నది ఎనాడైనా నువ్వక్కడ.. నేనిక్కడ పాటిక్కడ.. పలుకక్కడ మనసొక్కటి కలిసున్నది ఎనాడైనా ఈ పువ్వులనే నీ నవ్వులుగా.. ఈ చుక్కలనే కన్నులుగా నును నిగ్గుల ఈ మొగ్గలు నీ బుగ్గలుగా ఊహల్లొ తేలీ వుర్రూతలూగీ.. మేఘాలతోటీ రాగాల లేఖా నీకంపినానూ.. రావా దేవీ జాబిల్లి కోసం.. ఆకాశమల్లే.. వేచాను నీ రాకకై నిను కాన లేకా.. మనసూరుకోకా.. పాడాను నేనూ పాటనై జాబిల్లి కోసం.. ఆకాశమల్లే.. వేచాను నీ రాకకై వేచాను నీ రాకకై నీ పేరొక జపమైనది నీ ప్రేమొక తపమైనది నీ
Yemi Cheyamanduve,Sad,2005,Shankar Mahadevan,"లేదని చెప్ప నిమిషము చాలు, లేదన్నమాట తట్టుకోమంటే. మళ్ళి మళ్ళి నాకొక జన్మేకావలే, ఏమి చేయమందువే. గంధపు గాలిని తలుపులు ఆపుట న్యాయమా, న్యాయమా. ప్రేమల ప్రశ్నకు కన్నుల బదులంటే మౌనమా, మౌనమా. చెలియా నాలొ ప్రేమను తెలుపా ఒక ఘడియ చాలులే, అదె నేను ఋజువె చేయ నూరేళ్ళు చాలవే. హృదయమొక అద్దమని నీ రూపు బింబమని, తెలిపేను హృదయం నీకు సొంతమనీ. బింబాన్ని బంధించ తాడేది లేదు సఖి, అద్దలా ఉయల బింబముగె చెలీ. నువు తేల్చి చెప్పవే పిల్లా, లేక కాల్చి చంపవే లైలా. నా జీవితం నీ కనుపాపలతొ వెంటాడి ఇక వేటాడొద్దే. విశ్వసుందరీమణులె వచ్చి నీ పాదపూజ చేస్తారె, నా ప్రియ సఖియా ఇక భయమేలా. నా మనసెరిగి నాతోడుగ రావే. ఏమి చేయమందువే, న్యాయమా, మౌనమా"
Jaragandi,Upbeat,2024,"Sunidhi Chauhan, Daler Mehendi",ముప్పావ్‍లా పెళ్ళన్నాడే మురిపాల సిన్నోడే ముద్దే ముందిమ్మన్నాడే మంత్రాలు మర్నాడే. గుమ్స్ గుంతాక్స్ చిక్స్. జరగండి జరగండి జరగండీ జాబిలమ్మ జాకెటేసుకొచ్చెనండీ జరగండి జరగండి జరగండీ ప్యారడైజ్ పావడేసుకొచ్చెనండీ. సిక్సర్ ప్యాకులో యముడండీ సిస్టం తప్పితే మొగుడండీ థండర్ స్టార్ములా టిండర్ సీమనే చుడతది వీడి గారడీ. జరగండి జరగండి జరగండీ మార్సు నుంచి మాసు పీసు వచ్చెనండీ పిల్లగాడు సూడె పిచ్చి లేపుతాడే కుర్రగాడు సూడె కుచ్చు లాగుతాడే. ఎయ్ జరగండి జరగండి జరగండీ స్టారులొక్కటైన స్టారు వచ్చెనండీ. ముప్పావ్‍లా పెళ్ళన్నాడే మురిపాల సిన్నోడే ముద్దే ముందిమ్మన్నాడే మంత్రాలు మర్నాడే. హస్కు బుస్కు లస్కండి మరో ఎలన్ మస్కండి జస్క మస్క రస్కండి రిస్కేనండి. సిల్కు షర్టు హల్కండి రెండు కళ్ళ జల్కండి బెల్లు బటన్ నొక్కండి సప్రైజ్ చేయ్యండి. గుమ్స్ గుంతాక్స్ చిక్స్ గుమ్స్ గుంతాక్స్ చిక్స్. పాలబుగ్గపై తెల్లవారులు పబ్జీలాడే పిల్లడే పూలపక్కపై మూడు పూటలు సర్జికల్ స్ట్రైక్ చేస్తడే పిల్లో ఎక్కడో ఏయ్ ఓయ్ ఓయ్ ఓయ్ పిల్లో ఎక్కడో ఉంటూనే కల్లో డ్రోన్ ఎటాక్ చేస్తావే. సూపర్ సోనికో హైపర్ సోనికో సరిపడ వీడి స్పీడుకే. జరగండి జరగండి జరగండీ గూగులెతికిన గుమ్స్ వచ్చెనండీ ఓయ్ జరగండి జరగండి జరగండీ పువ్వులొక్కటైన పువ్వు వచ్చెనండీ. సిక్సర్ ప్యాకులో యముడండీ సిస్టం తప్పితే మొగుడండీ థండర్ స్టార్ములా టిండర్ సీమనే చుడతది వీడి గారడీ. జరగండి జరగండి జరగండీ కిస్సుల కలాష్నికోవ్ వచ్చెనండీ పిల్లగాడు సూడె పిచ్చి లేపుతాడే కుర్రగాడు సూడె కుచ్చు లాగుతాడే. జరగండి జరగండి జరగండీ దుమ్ములేపు గుంత
Ticket Eh Konakunda,Upbeat,2024,Ram Miryala,టికెటే కొనకుండా లాటరీ కొట్టిన సిన్నోడా సిట్టి నీది సిరుగుతుందేమో సుడరా బుల్లోడా ఆ మూసుకొని కూసోకుండా గాలం వేసావ్ పబ్బు కాడ సొర్ర సాపే తగులుకుంది తీరింది కదరా మురిసిపోకు ముందున్నాది కొంప కొల్లేరయ్యే తేది ఓహో గాలికి పోయే కంప నెత్తి కొచ్చి సుట్టుకున్నాది హా ఆలి లేదు సూలు లేదు గాలే తప్ప మ్యాటరు లేదు ఆహా ఏది ఏమైన గాని టిల్లు గానికడ్డే లేదు టిల్లన్నా ఇలాగైతే ఎల్లాగన్నా స్టోరీ మళ్ళీ రిపీటేనా పోరి దెబ్బకు మళ్లీ నువ్వు తానా తందనా టిల్లన్న ఎట్ల నీకు జెప్పాలన్నా తెలిసీ తెల్వక జేత్తావన్న ఇల్లే పీకి పందిరి ఏస్తావ్ ఏందీ హైరానా టికెటే కొనకుండా లాటరీ కొట్టిన సిన్నోడా సిట్టి నీది సిరుగుతుందేమో సుడరా బుల్లోడా మూసుకొని కూసోకుండా గాలం వేసావ్ పబ్బు కాడ సొర్ర సాపే తగులుకుంది తీరింది కదరా అల్లి గాడు మల్లి గాడు కాదు టిల్లు గాడు కిర్రాకీడు మందులోకి పల్లీ లాగ లొల్లి లేకుండా ఉండ లేడు తొందరెక్కువమ్మ వీడికి తెల్లారకుండా కూసేస్తాడు బోని కొట్టకుండా నేను డాడీ నైపోయానంటాడు అయ్యనే లెక్క జెయ్యడు ఎవ్వడయ్యెచ్చి జెప్పిన ఆగడు పోరడు అస్సలినడు సిత్తరాలే సూపిత్తడు ప్రేమిస్తడు పడి చస్తడు ప్రాణమిమ్మంటే ఇచ్చేస్తడు తగులుకుండంటే వదులుకోలేడు బిడ్డ ఆగమై పోతున్నాడు టిల్లన్నా ఇలాగైతే ఎల్లాగన్నా స్టోరీ మళ్ళీ రిపీటేనా పోరి దెబ్బకు మళ్లీ నువ్వు తానా తందనా టిల్లన్న ఎట్ల నీకు జెప్పాలన్నా తెలిసీ తెల్వక జేత్తావన్న ఇల్లే పీకి పందిరి ఏస్తావ్ ఏందీ హైరానా టికెటే కొనకుండా లాటరీ కొట్టిన సిన్నోడా సిట్టి నీది సిరుగుతుందేమో సుడరా బుల్లోడా మూసు
Odiyamma,Upbeat,2024,"Dhruv, Chinamayi",పైకి తీయి లోన హాయిని బైటవేయి లోపలోడిని దాచుకోకు ఇంకా దేనిని గోలే నీ పని తొంగి చూడు కింద నింగిని గాలికేయి కొత్త రంగుని నిన్న నింక నేడు మింగని దాంతో ఏం పని ఒక షాటులో ఉత్సాహమే ఒక షాటులో ఉల్లాసమే ఒక షాటులో ఉక్రోషమే ప్రతి షాటు లోపలే ఓడియమ్మ హీటు ఈడిఎం లో బీటు రేడియంలా లైటు పార్టీలో ఇటు అటు ఓడియమ్మ హీటు ఈడిఎంలో బీటు రేడియంలా లైటు పార్టీలో ఇటు అటు తాగితే మరిచిపోగలను తాగనివ్వదు మరిచిపోతే తాగగలను మరువనివ్వదు ఫీల్ హై ఫీల్ దిస్ హై నాతో చెయ్ కలిపేయ్ అరె దేన్నో చూస్తావే కాలం చల్తా హై భేజా ఉడ్తా హై వదిలేసెయ్ వచ్చేసెయ్ యయ్ యయ్ యా ఒక గ్లాసులో ఆనందమే ఒక గ్లాసులో ఆలోచనే ఒక గ్లాసులో ఆవేశమే ప్రతి గ్లాసు ఖాళీ చెయ్ ఓడియమ్మ హీటు ఈడిఎం లో బీటు రేడియంలా లైటు పార్టీలో ఇటు అటు ఓడియమ్మ హీటు ఈడిఎం లో బీటు రేడియంలా లైటు పార్టీలో ఇటు అటు జోరుగున్నదో జారుతున్నదో జన్మకేమయిందో ఊహ నిజములా నిజము ఊహలా తోచి తోసినాయో జరుగుతున్నదే జరగనున్నదో జరిగిపోయినాదో తిరుగుతున్నదో తిప్పుతున్నదో డే జా వు నీ పాత్ ఓ పాతాలమే ఈ కైపులో కైలాసమే నా వైబ్ లో వైకుంఠమే ఈ మైకం మోక్షమే.
Tillu Anna DJ Pedithe,Upbeat,2022,Ram Miryala,"లాలగూడ అంబరుపేట, మల్లేపల్లి మలక్ పేట, టిల్లు అన్న డీజే పెడితే టిల్ల టిల్ల ఆడాలా. మల్లేశన్న దావత్లా, బన్ను గాని బారత్లా, టిల్లు అన్న దిగిండంటే డించక్ డించక్ దున్కాలా. డీజే టిల్లు పేరు, వీని స్టయిలే వేరు. సోకేమో హీరో తీరు, కొట్టేది తీనుమారు. డీజే టిల్లు కొట్టు కొట్టు, డీజే టిల్లు కొట్టు. బేసు జర పెంచి కొట్టు, బాక్సులు పలిగేటట్టు. డీజే టిల్లు పేరు, వీని సౌండే వేరు. కట్ జేసి కొట్టిండంటే, దద్దరిల్లు డాన్సు ఫ్లోరు. డీజే టిల్లు కొట్టు కొట్టు, డీజే టిల్లు కొట్టు. డీజే టిల్లు కొట్టు, కొట్టకుంటే నామీదొట్టు. అరె చమ్కీ షర్టు ఆహ, వీని గుంగురు జుట్టు ఒహో. అట్లా ఎల్లిండంటే సార్లే సలాం కొట్టు. ఏ గల్లీ సుట్టూ ఆహ, అత్తరే జల్లినట్టు ఒహో. మస్తుగా నవ్విండంటే, పోరిలా దిల్లు ఫట్టు అది. అన్న ఫోటో పెట్టుకొని, జిమ్ము సెంటర్లన్నీ, పోటీ పడి పడీ పబ్లిసిటి జేత్తయే. వీని హవా జూత్తే పోరాలల్ల శివాలే. కార్పొరేటర్కైనా డైరెక్టుగా ఫోన్ కొడతాడే ఓ. డీజే టిల్లు పేరు, వీని స్టయిలే వేరు. సోకేమో హీరో తీరు, కొట్టేది తీనుమారు. డీజే టిల్లు కొట్టు కొట్టు, డీజే టిల్లు కొట్టు. బేసు జర పెంచి కొట్టు, బాక్సులు పలిగేటట్టు. డీజే టిల్లు పేరు, వీని సౌండే వేరు. కట్ జేసి కొట్టిండంటే, దద్దరిల్లు డాన్సు ఫ్లోరు. డీజే టిల్లు కొట్టు కొట్టు, డీజే టిల్లు కొట్టు. డీజే టిల్లు కొట్టు, కొట్టకుంటే నామీదొట్టు."
Time to Party,Upbeat,2013,David Simon,"ఓరి దేవుడో దేవుడో ఏంపిల్లగాడే కొంచం అయినా వదలకుండా లో నిండినాడే కళ్ళల్లోన కత్తులున్న తీవ్రవాదిలా మాటల్లోన మత్తులున్న మంత్రవాదిలా పరేషాను చేస్తున్నాడిలా పట్టుకో, పట్టుకో"" అనే భాగాన్ని తెలుగులో అనువదించాము. తర్వాత, ఇది సమయం పార్టీ చేయడానికి సమయం.ఇది సమయం పార్టీ చేయడానికి సమయం.రావే ఒ పిల్లా. రావే ఓ పిల్లా  చేద్దాం గోల ఇది సమయం పార్టీ చేయడానికి సమయం.ఇది సమయం పార్టీ చేయడానికి సమయం.రావే ఒ పిల్లా. రావే ఓ పిల్లా మనకంటే గొప్పోళ్ళా టాటా బిర్లా"" అనే పాటను అనువదించాము. అంతే, పారాగ్రాఫ్ మూలాలను తెలుగులో వ్యాఖ్యానించబడింది."
Vacchindhi Kadha Avakaasam,Upbeat,2016,Abhay,వచ్చింది కదా అవకాశం ఓ మంచి మాట అనుకుందాం ఎందుకు ఆలస్యం అందర్నీరమ్మందాం బంగారు బంగారు బంగారు బంగారు బంగారు బంగారు బంగారు బంగారు బంగారు బంగారు వే సంగీతంలో స ప స రాకపోతే ఎం లోటా సంతోషంలో హైలెస్సా అంటే ఏదో పొరపాటా అటెంషన్ ఎవేరిబోడి సరదాగా సై ఆడండి ఏబీసీడీ చాలండి ఎనీ బాడీ కెన్ డాన్స్ అండి సంగీతంలో స ప స రాకపోతే ఎం లోటా సంతోషంలో హైలెస్సా అంటే ఏదో పొరపాటా ఏ ఆనందమంటే పైనెదొ లేదే మనలోనే దాగుంది చిరు నవ్వు దీపం వెలిగించి చూస్తే మనకే తెలుస్తుంది ఆట పాటా హలో అంటే ఆలోచిస్తూ ఎటో చూడకు సరేలే సరదా సాకులెందుకు ఏ పూటంటే ఆ పూటే ఏ చోటంటే ఆ చోటే హ్యాపీ గా ఉండాలంటే వుండాలనుకోవాలంటే భూగోళమంతా మోసే పనేదో మన మీదనే ఉందా లోకాన వుండే చికాకు మొత్తం మన కొరకే పుట్టిందా ఎవరికి వారే ఏదో మూల ఏకాంతంగా ఉంటారేంటల పలుకే కరువై మూగ నోముల అనుకుందేదో కాదంటే ఇంకేదో అవుతూ ఉంటే కానియిలే అందమంటే కష్టం నీకిచ్చేస్తుందే అటెంషన్ ఎవేరిబోడి సరదాగా సై ఆడండి ఏబీసీడీ చాలండి ఎనీ బాడీ కెన్ డాన్స్ అండి.
Aata Paataladu,Upbeat,2016,Karthik,ఆట పాటలాడు నలుగురిలో మాటలాడు చూడు మనసులతో చెలిమల్లుకొని మనుషులతో దారి పొడుగు పయనంలో దారి చూపిన నడకలతో ఆడి పాడి ఆడి పాడే ఈ క్షణమన్నది నిజమే అయితే చూడని రేపుని ఇప్పుడే కణమా అలవాటైతే ఈ ఉత్సవమే మది మరి మరి కోరదా మరల మరల. చూసినదేదైనా చూడనివేవైనా చూపుకి దొరికినదే కనువిందవదా ఒకరికి పదుగురిగా కన్నది ఏదైనా విన్నది ఏదైనా పది పది అవదా తెలుపుతోనీ నేను నా సంగతులేవో తెలుసుకొని నేను నీ గుసగుసలేదో అడగమని తెలుపమని మనలో మనకే మనతో మనమే ఈ క్షణమన్నది నిజమే అయితే చూడని రేపుని ఇప్పుడే కణమా అలవాటైతే ఈ ఉత్సవమే మది మరి మరి కోరదా మరల మరల. వున్నది ఏదైనా వుండేదేదైనా వుండటమొకటేలే అద్భుతమవధా దూరం ఎంతున్నా చేరేదెప్పుడైనా మనమై నడిచినదే సగమై అవదా కళ్ళతోనే దాగిన కళలను యేవో మనసు ధాటి రానానే కధలను యేవో చూపమని చెప్పమని మనలో మనకే మనతో మనమే ఈ క్షణమన్నది నిజమే అయితే చూడని రేపుని ఇప్పుడే కనమా అలవాటైతే ఈ ఉత్సవమే మది మరి మరి కోరదా మరల మరల.
Super Machi,Upbeat,2015,"DSP, Shravana",మల్లి గాడి ఇంటికాడ మల్లెపూలు కోసుకుంటే చందుగాడి సందు కాడ చందమామ చూసుకుంటే సుబ్బుగాడి దిబ్బకాడ సన్నజాజులేరుకుంటే పోటు గాడి తోట కాడ సన్ గ్లాసు లెత్తుకుంటే చాకిరేవు గట్టు కాడ కొత్త సబ్బు రుద్దుకుంటే సింగపూర్ సెంట్ తీసి కస్సు కస్సు కొట్టుకుంటే ముత్యమున్న ముక్కు పుడక ముక్కు మీద పెట్టుకుంటే రోల్డ్ గోల్డ్ గాజులేసి చేతులేమో ఘల్లుమంటే సీర కట్టునేమో నేను అట్ట ఇట్టా సర్దుకుంటే సింగారి కుంకుమేట్టి పెద్ద బొట్టు దిద్దుకుంటే అద్దంలో చూసుకుంటే నాకు నేను ముద్దుగుంటే కుర్రాళ్ళ చూపులన్నీ వచ్చి నన్ను గుచ్చుకుంటే సూపర్ మచ్చి అట్టా సూపర్ మచ్చి సూపర్ మచ్చి అరేయ్ సూపర్ మచ్చి. ఈరబాబు ఇంటికాడ ఈత కళ్ళు తాగుతుంటే బీరు లాంటి పిల్ల వచ్చి .
