name ,mood,year,artist,lyrics
Cheliya Cheliya,Sad,2012,"Anirudh Ravichander,Mohit Chauhan",పో వె పో… పో వె పో ఏకాకై నిలచునా పిలవదె గుమ్మ పో సేవిల్లె మిగిలానే కలవోద్దె తలుం పో తానువందా పెనుమంత రగిలిందే చెలియ పో రేపో యే క్షనమైనా నననోడిలే గుమ్మ పో కలవదె గుమ్మ పో వెతకడె గుమ్మ పో విధి ఆత మొదలయ్యె ననును వీడి గుమ్మ పో పో వె పో పో వె పో ఏకాకై నిలచునా పిలవదె గుమ్మ పో సేవిల్లె మిగిలానే కలవోద్దె తలుం పో నీ వాల్లే నెన్నుంటైన్ నీ కొసం పిల్లా.. తోలి వలపే చోటిచ్చినావు మరిచావా పిల్లా మనసున మల్లెలు విరిసినా రొజులు మారి మారి వచే కహానామ ఇదె తానువును దోచైన్ తామపు జాదులు ననుు విదిడిపోచిన సడి యెదె ఓహో.. హూరో… సృ.. హూయో పో వె పో పో వె పో నా గుండే వెలుపాలనే మిగులాయేనీ గుమ్మ పో నా కలలొ కన్నరే మిగిలయి గుమ్మా పో తానువందిత పెనుమంత రగిలిందే చెలియ పో రేపో యే క్షనమైనా నననోడిలే గుమ్మ పో కలవదె గుమ్మ పో వెతకడె గుమ్మ పో విధి ఆత మొదలయ్యె ననును వీడి గుమ్మ పో ఏకాకై నిలచునా పిలవదె గుమ్మ పో సేవిల్లె మిగిలానే కలవోద్దె తలుం పో
Nammaka Tappani,Sad,2006,"Sagar,Sumangaly",నమ్మక తప్పని నిజమైనా నువ్విక రావని చెబుతున్నా ఎందుకు వినదో నా మది ఇప్పుడైనా ఎవ్వరు ఎదురుగ వస్తున్నా నువ్వేమో అనుకుంటున్నా నీ రూపం నా చూపుల నొదిలేనా ఎందరితో కలిసున్న నేనొంటరిగానే ఉన్నా నువ్వొదిలిన ఈ ఏకాంతంలోనా కన్నులు తెరిచే ఉన్నా నువ్వు నిన్నటి కలవే అయినా ఇప్పటికీ ఆ కలలోనే వున్నా నమ్మక తప్పని నిజమైనా నువ్విక రావని చెబుతున్నా ఎందుకు వినదో నా మది ఇప్పుడైనా ఈ జన్మంతా విడిపోదీ జంటా అని దీవించిన గుడిగంటను ఇక నా మది వింటుందా నా వెనువెంటా నువ్వే లేకుండా రోజూ చూసిన ఏ చోటైనా నను గుర్తిస్తుందా నిలువునా నను తడిమి అలా వెనుదిరిగిన చెలిమి అలా తడి కనులతో నిను వెతికేది ఎలా నమ్మక తప్పని నిజమైనా నువ్విక రావని చెబుతున్నా ఎందుకు వినదో నా మది ఇప్పుడైనా నీ స్నేహంలో వెలిగే వెన్నెల్లో కొన్నాళ్ళైనా సంతోషంగా గడిచాయనుకోనా నా ఊహల్లో కలిగే వేదనలో ఎన్నాళ్ళైనా ఈ నడిరాతిరి గడవదు అనుకోనా చిరునవ్వుల పరిచయమా సిరిమల్లెలా పరిమలహమా చేజారిన ఆశల తొలివరమా నమ్మక తప్పని నిజమైనా నువ్విక రావని చెబుతున్నా ఎందుకు వినదో న
Attu Nuvve,Sad,2009,Neha Bhasin,అటు నువ్వే ఇటు నువ్వే మనసెటు చుస్తే అటు నువ్వే ఎటు వెళ్తున్న ఎం చేస్తున్న ప్రతిచోటా నువ్వే అటు నువ్వే ఇటు నువ్వే అలికిడి వింటే అది నువ్వే అధమరపైనా పెదవుల పైనా ప్రతి మాట నువ్వే అప్పుడో ఇపుడో ఎపుడైనా నా చిరునవ్వే నీవలన తెలియని లోకం తీపిని నాకు రుచి చూపావులే పరిచయమంతా గతమేనా గురుతుకు రానా క్షణమైనా ఎదురుగా వున్నా నిజమేకాని కళావైనావులే రంగు రూపమంటూ లేనే లేనిదీ ప్రేమా చుట్టూ శున్యంఉన్న నిన్ను చూపిస్తూ వుంది దూరం దగ్గరంటూ తేడా చూడది ప్రేమ నీల చెంత చేరి నన్ను మాటాడిస్తుంది కనుపాప లోతులో దిగీపోయింతలా ఒక రెప్పపాటు కాలమైనా మరుపే రావుగా యద మారు మూలలో ఒదిగిన్న ప్రాణమై నువ్వు లేని నేను లేనే లేను అనిపించావుగా అటు నువ్వే ఇటు నువ్వే మనసెటు చుస్తే అటు నువ్వే ఎటు వెళ్తున్న ఎం చేస్తున్న ప్రతిచోటా నువ్వే అటు నువ్వే ఇటు నువ్వే అలికిడి వింటే అది నువ్వే అధమరపైనా పెదవుల పైనా ప్రతి మాట నువ్వే
Oosupodu,Sad,2017,Hemachandra Vedala,ఊసుపోదు ఊరుకోదు ఉండనీదు వెల్లనీదు ఇంత ఖైదు నాకిల ఏమిటో సోయి లేదు సోలనీదు వీడిపోదు చేరి రాదు చింతపోదు నాకిల ఏమిటో ఊసుపోదు ఊరుకోదు ఉండనీదు వెల్లనీదు ఇంత ఖైదు నాకిల ఏమిటో సోయి లేదు సోలనీదు వీడిపోదు చేరి రాదు చింతపోదు నాకిల ఏమిటో నా నుండి నా ప్రాణమే ఇలా జారుతోందె తప్పేన ఈ యాతనా నీ వైపు రావాలనే అలా ఉరికుతోందె ఆగేదేనా అరె ఈ ఆలోచనా నీ తలపులే వొదలవే నన్ను నిదురలోను ఆ మలుపులో తెలియక నన్నే వెతికినాను వల్ల కాదు పాలు పోదు ఆగనీదు సాగనీదు వెంట రాదు నాకిలా ఏమిటో వేళా కాదు వీలు లేదు ఊహ కాదు ఓర్చు కోదు చెంత లేదు నాకిలా ఏమిటో నా నుండి నా ప్రాణమే ఇలా జారుతోందె తప్పేన ఈ యాతనా నీ వైపు రావాలనే అలా ఉరికుతోందె ఆగేదేనా అరె ఈ ఆలోచనా నీ తలపులే వొదలవే నన్ను నిదురలోను ఆ మలుపులో తెలియక నన్నే వెతికినాను నా గుండెలో తొందరే నన్నే నిలువనీదె ఏదొనాడు నీతో చెప్పెయనా నీ పిలిపులే కల
Allantha Doorala,Sad,2007,S.P.Balasubramanyam,అల్లంత దూరాల ఆ తారక కళ్ళెదుట నిలిచిందా ఈ తీరుగా అరుదైన చిన్నారిగా కోవెల్లో దేవేరిగా గుండెల్లో కొలువుండగా భూమి కనలేదు ఇన్నాళ్ళుగా ఈమెలా వున్న ఏ పోలిక అరుదైన చిన్నారిగా కోవెల్లో దేవేరిగా గుండెల్లో కొలువుండగా అల్లంత దూరాల ఆ తారక కళ్ళెదుట నిలిచిందా ఈ తీరుగా కన్యాదానంగా ఈ సంపద చేపట్టే ఆ వరుడు శ్రీహరి కాడా పొందాలనుకున్నా పొందే వీలుందా అందరికి అందనిదీ సుందరి నీడ ఇందరి చేతులు పంచిన మమత పచ్చగ పెంచిన పూవులతో నిత్యం విరిసే నందనమవగా అందానికే అందమనిపించగా దిగి వచ్చెనో ఏమో దివి కానుక అరుదైన చిన్నారిగా కోవెల్లో దేవేరిగా గుండెల్లో కొలువుండగా తన వయ్యారంతో ఈ చిన్నది లాగిందో ఎందరిని నిలబడనీక ఎన్నో ఒంపుల్తో పొంగే ఈ నది తనే మదిని ముంచిందో ఎవరికి ఎరుక తొలి పరిచయమొక తీయని కలగా నిలిపిన హృదయమే సాక్షిగా ప్రతి జ్ఞాపకం దీవించగా చెలి జీవితం వెలిగించగా అల్లంత దూరాల ఆ తారక కళ్ళెదుట నిలిచిందా ఈ తీరుగా
Manasanta Mukkalu Chesi,Sad,2011,KK,మనసంతా ముక్కలు చేసి పక్కకు వెళతావెందుకు ఓ నేస్తం ఊరించి ఊహలు పెంచి తప్పుకుపోతావెందుకు ఆ పంతం నీకై నీకై ప్రాణాలిస్తానన్నా ఇంకా ఇంకా అలుసై పోతున్నానా పొరపాటుంటే మన్నించవే మనసంతా ముక్కలు చేసి పక్కకు వెళతావెందుకు ఓ నేస్తం ఊరించి ఊహలు పెంచి తప్పుకుపోతావెందుకు ఆ పంతం విరిసిన పువ్వుల కొమ్మ తను పెనవేసిన ఒక రెమ్మ ఎవరో తెంచేస్తువుంటే వొప్పుకుంటదా బుడు బుడి అడుగుల పాపైనా తను ఆడుకునేదొక బొమ్మైన ఎవరో లాగేసుకుంటే వూరుకుంటదా నువ్వు నచ్చి మానసిచ్చి ఇప్పుడిక్క ఇది చూస్తుంటే కనుపాపల్లో కునుకుండదే ఓఓఓ మనసంతా ముక్కలు చేసి పక్కకు వెళతావెందుకు ఓ నేస్తం ఊరించి ఊహలు పెంచి తప్పుకుపోతావెందుకు ఆ పంతం వెలుతురు వున్నపుడేగా నీ వెనుకనే ఉంటది నీడ ఉంటా నడిరాతిరైనా నీకు తోడుగా చిగురులు తిన్నపుడేగా ఆ కుహు కుహు కోయిల పాట అవుతా నీ గుండెలయగా అన్నివేళలా నిను కోర ఇటు చెర నువ్వు ఎటువైపో అడుగేస్తే ఎదలోతుల్లో కుదురుండదే ఓఓఓ ఊఊ మనసంతా మనసంతా ముక్కలు చేసి పక్కకు వెళతావెందుకు ఓ నేస్తం ఊరించి ఊహలు పెంచి తప్పుకుపోతావ
Kanureppala Kaalam,Sad,2018,Gopi Sundar,కనురెప్పల కాలం లోనే కథ మొత్తం మారె పోయిందే కనుతెరిచి చూసేలోగా ధరిచేరని దూరం మిగిలిందే ఇన్నాళ్లు ఊహల్లో ఈ నిమిషం సూన్యంలో మిగిలాన్నే ఒంటరినై విడిపోయే వేడుకలో జరిగినది వింతేన మన పయనం ఇంతేనా కనురెప్పల కాలం లోనే కథ మొత్తం మారె పోయిందే కవి ఎవరో ఈ కథకి ఎవరెవరో పాత్రలకి తెలియదు గా ఇప్పటికి పొదుపు కథే ఎప్పటికి మనమంతా అనుకున్న ఒంటరిగానే మిగిలిఉన్న ఇందరిలో కలిసిఉన్న వెలితిని నేను చూస్తున్న పొరపాటు ఏదో తోరబాటు ఏదో అది దాటలేని తడబాటు ఏదో ఎడబాటు చేసే ఈ గీతను దాటలేవా
Telisiney Na Nuvvey,Sad,2017,L.V.Revanth,తెలిసేనే నా నువ్వే నా నువ్వు కాదని తెలిసేనే నీ నేనే నీ నేను కానని నాలో సగం ఇక లేదూ అని ఆ నిన్నలే నన్ను చూసి నువ్వేలే మరునాడు అన్నదే ఇక ఉందబోదని అన్నాదీక్షణం హ్మ్మ్ హ్మ్మ్ హ్మ్మ్ .. నా ప్రాణం నువ్వే నా గుండె నువ్వే గుండెల్లో మండే నిప్పై చేరావే ఊహలకే తెలియనిదే జరిగేనులే ఇప్పుడిలా నువ్వు నేను అను మాటే ఇకపై ఉండదులే ఏంటిలా తప్పు ఏదో జరిగేనె రెప్ప పాటులో ఓహ్ చెప్పలేని వేదనగా ఉప్పెనల్లె తరుముతోందే నువ్వు లేనిదే మరి నేను లేనని అన్న ఈ క్షణం నా అంతం నువ్వే నా పంతం నువ్వే నా పంతం ఎంతా ఈ విశ్వమంతా నా అంతం నువ్వే నా పంతం నువ్వే నా పంతం ఎంతా ఈ విశ్వమంతా
Em Cheppanu,Sad,2018,Karthik,ఎం చెప్పను నిన్నెలా ఆపను ఓ ప్రాణమా నిన్నెలా వదలను ఏ ప్రశ్నను ఎవరినేం అడగను ఓ మౌనమా నిన్నెలా దాటను పెదాల పైన నవ్వు పూత పూసుకున్న నేనే కన్నీటితో ఈవేళ దాన్నెలా చేరపను తన జ్ఞాపకమైన తగదని మనసునేలా మార్చను ఈ ప్రేమకి ఏమిటి వేడుక ఎ జన్మకి జంటగా ఉండక ఇదివరకలవాటు లేనిది మనసుకి ఈ మమత కొత్తది దొరకక దొరికింది గనుక చేయి జారుతుంటే ఎం తోచకున్నది ఊరించిన నిలిమబ్బుని ఉహించని గాలి తాకిడి ఎటువైపో తరుముతుంటే కళ్ళారా చూస్తూ ఎల్లా మరి ఎడారి వైపు వెళ్లకంటూ ఆపి వాన చెలిని తడారుతున్న గుండెలోకి రా రమ్మని తన వెంటపడి ఇటు తిసుకురాలేవా ఉపిరి ఈ ప్రేమకి ఏమిటి వేడుకా ఎ జన్మకి జంటగా ఉండక
O Manasa O Manasa,Sad,2000,Ravi Varma,ఓ మనసా ఓ మనసా చెబితే వినవా నువ్వు నీ మమతే మాయ కదా నిజమే కనవా నువ్వు చెలియ గుండె తాకలేక పలకనందే నా మౌనం చెలిమి వెంట సాగలేక శిల అయిందే నా ప్రాణం గతమే మరిచి బ్రతకాలే మనసా ఎగసి పడే అల కోసం దిగివస్తుందా ఆకాశం తపన పడి ఏం లాభం అందని జాబిలి జత కోసం కలిసి ఉన్న కొంత కాలం వెనక జన్మ వరమనుకో కలిసి రాని ప్రేమ తీరం తీరిపోయిన రుణమనుకో మిగిలే స్మృతులే వరమనుకో మనసా ఓ మనసా ఓ మనసా చెబితే వినవా నువ్వు నీ మమతే మాయ కదా నిజమే కనవా నువ్వు తన ఒడిలో పొదువుకుని భద్రంగా నడిపే నౌక తననొదిలి వెళ్ళకని ఏ బంధాన్ని కోరదుగా కడలిలోనే ఆగుతుందా కదలనంటు ఏ పయనం వెలుగు వైపు చూడనందా నిదర లేచే నా నయనం కరిగే కలలే తరిమే ఓ మనసా ఓ మనసా చెబితే వినవా నువ్వు నీ మమతే మాయ కదా నిజమే కనవా నువ్వు
Love Me Again ,Sad,2015,Sooraj Santhosh,నిదరోని తూరుపు కోసం సూరీడే మళ్ళీ రాడా... జతలేని తారల కోసం జాబిల్లే మళ్ళీ రాదా... అడుగెయ్యని తీరం కోసం అలలైనా మళ్ళీ రావా... అడుగుతున్నా నిన్నే మళ్ళీ... ప్రేమించైవా... ఓ.... లవ్ మి‌ ఎగైన్... లవ్ మి‌ ఎగైన్... లవ్ మి‌ ఎగైన్... లవ్ మి‌ ఎగైన్... కలలైనా కన్నీళ్లయినా... కన్నులలో మళ్ళీ రావా... గుబులైనా సంబరమైనా... గుండెలలొ మళ్ళీ రాదా... మళ్ళీ చూసేవు మళ్ళీ నవ్వేవు... నిన్న మొన్న చేసిందే మళ్ళీ మళ్ళీ చేసేవూ... చూపిన కోపాన్నే మళ్ళీ నాపై చూపైవూ... మళ్ళీ నన్నే ప్రేమించరాలేవా.... ఓ.... లవ్ మి‌ ఎగైన్... లవ్ మి‌ ఎగైన్... లవ్ మి‌ ఎగైన్... లవ్ మి‌ ఎగైన్... మనసారా బతిమాలానే... మన్నించవే నను తొలిసారి... పొరపాటే జరగదు లేవే... ప్రేమించవే రెండోసారి... మళ్ళీ వస్తాను మళ్ళీ చూస్తాను... మళ్ళీ నీకె పరిచయమౌతాను... మళ్ళీ నా మనసు నీకందిస్తాను... అలవాటుగా నన్ను ప్రేమించవా... ఓ..లవ్ మి‌ ఎగైన్... లవ్ మి‌ ఎగైన్... లవ్ మి‌ ఎగైన్... లవ్ మి‌ ఎగైన్..
Naa Madhi,Sad,2022,Dhanunjaya Seepana,నా మది పువ్వది వాడిపోతూ ఉన్నదీ చిన్నది చెయ్ విడి చిత్రహింసే అయినది నిన్ను తలచుకు మతి చెడిపోను దేవుడా అని దిగులైపోను పైకి బాధగ కనపడనీ మనసు పగిలిన మనిషినిలే నా మది పువ్వది వాడిపోతూ ఉన్నదీ చిన్నది చెయ్ విడి చిత్రహింసే అయినది నిజమే నాదేలే పాపం అతిగా ప్రేమిస్తే ఫలితం శాపం మనసే నాలోని లోపం కనుకే గుండెల్లో మిగిలే గాయం నీడే ఇక లేదులే నా లోకం చీకట మాటే తెగి రాదులే మౌనాలు దాటగా తప్పంతా నాదే పిల్లా నీ ప్రేమకొట్టే జల్లా నా మది పువ్వది వాడిపోతూ ఉన్నదీ చిన్నది చెయ్ విడి చిత్రహింసే అయినది నిన్ను తలచుకు మతి చెడిపోను దేవుడా అని దిగులైపోను పైకి బాధగ కనపడనీ మనసు పగిలిన మనిషినిలే నా మది పువ్వది వాడిపోతూ ఉన్నదీ చిన్నది చెయ్ విడి చిత్రహింసే అయినది
Ori Vaari,Sad,2023,Santhosh Narayan,ఓరి వారి నీది గాదురా పోరి ఇడిసెయ్ రా ఇంగ ఒడిసెను దారి ఓపారి అవ్వ ఒడిలో దూరి మరిసెయ్ రా సిన్న మొల్లిగా మారి బాల్యమే గొప్పది బాధ మర్షిపోతది చందమామ రాదనే నిజము నమ్మనంటది చిన్న పల్లీపట్టీకె ఏడుపాపి చూస్తది కోడె ఈడు సెడ్డది నిజాన్ని కోడై కూస్తది ఓరి వారి నీది గాదురా పోరి బజ్జోరా సంటి బిడ్డగా మారి హో హో హో హో హో హోహో హో హో ఓహో హోహో హో హో హో హో హో హోహో హో హో ఓహో హోహో హో ప్రేమ నాలో దాచిన చిన్న బొడ్డెమ్మగానే గావురంగా నిన్ను నేనే వద్దనీ గిరిగీసుకున్న గింత దెల్వకుంటా రగిలి నా వేదనే దీపమోలే వెట్టినా పేర్చినా బతుకమ్మనే కన్నీళ్ళలో సాగదోలిన ఇడిచేసి వదిలేశిన రెక్కలిరిగినట్టి ఈగ సుడిగాలిలో చిక్కినట్టు దిక్కు మొక్కు లేని కన్ను ఎక్కి ఎక్కి ఎడ్శినట్టు నీకు దగ్గరవ్వలేక దూరమయ్యే దారిలేక చితికిపోయే నా బతుకిలా గుండె పుండు మీద గొడ్డు కారమద్ది గుద్దుతుంటే గుక్కపెట్టి ఏడవలేని జన్మా ఓ ఓఓ ఓ ఓఓ ఓ ఊ ఊ ఊ ఊ ఊ ఊ ఊ హో హో హో హో హో హోహో హో హో ఓహో హోహో
