name ,mood,year,artist,lyrics
Kammani ,Romantic,1992,S. P. Balasubrahmanyam,"""కమ్మని ఈ ప్రేమ లేఖనే రాసింది హృదయమే, ప్రియతమా నీవచట కుశలమా, నేనిచట కుశలమే, ఊహలన్ని పాటలే కనుల తోటలో, తొలి కలల కవితలే మాట మాటలో, ఒహో.. కమ్మని ఈ ప్రేమలేఖనే రాసింది హృదయమే (ప్రియతమా). గుండెల్లో గాయమేమో చల్లంగా మానిపోయే, మాయ చేసే ఆ మాయే ప్రేమాయే, ఎంత గాయమైన గాని నా మేనికేమి గాదు, పువ్వు సోకి నీ సోకు కందేనే, వెలికి రాని వెర్రి ప్రేమ, కన్నీటి ధారలోన కరుగుతున్నది, నాదు శోకమోపలేక, నీ గుండె బాధపడితే తాళనన్నది, మనుషులెరుగలేరు మామూలు ప్రేమ కాదు, అగ్ని కంటే స్వచ్చమైనది, మమకారమే ఈ లాలి పాటగా రాసేది హృదయమా, ఉమదేవిగా శివుని అర్దభాగమై, నాలోన నిలువుమా, శుభలాలి లాలి జో లాలి లాలి జో, ఉమాదేవి లాలి జో లాలి లాలి జో, మమకారమే ఈ లాలి పాటగా రాసేది హృదయమా. నా హృదయమా."""
Bommani Geesthey,Romantic,2006,"Gopika Purnima,Jeans Srinivas","""బొమ్మని గీస్తే నీలా ఉందీ, దగ్గరకొచ్చి ఓ ముద్దిమ్మంది. సర్లెపాపం అని దగ్గరికెళితే దాని మనసే నీలో ఉందంది. ఆ ముద్దెదో నీకే ఇమ్మంది. సరసాలాడే వయసొచ్చింది, సరదా పడితే తప్పేముందీ. ఇవ్వాలనీ నాకూ ఉంది, కానీ సిగ్గే నన్ను ఆపింది. దానికి సమయం వేరే ఉందంది. చలిగాలి అంది చెలికి వణుకే పుడుతుంది, వెచ్చని కౌగిలిగా నిను అల్లుకుపొమ్మంది. చలినె తరిమేసే ఆ కిటుకే తెలుసండి, శ్రమపడిపోయేకండీ తమ సాయం వద్దండీ. పొమ్మంటావే బాలికా ఉంటానంటేఏ తోడుగా, హబ్బో ఎంత జాలిరా తమరికి నా మీద. ఎం చెయ్యాలమ్మా నీలో ఎదో దాగుంది, నీ వైపే నన్నే లాగింది. అందంగా ఉంది తనవెంటే పది మంది, పడకుండా చూడు అని నా మానసంటుంది. తమకే తెలియంది నా తోడై ఒకటుంది, మరెవరో కాదండీ అది నా నీడేనండీ. నీతో నడిచి దానికీ అలుపొస్తుందే జానకీ, హయ్యో అలక దేనికి నా నీడవు నువ్వేగ్గ. ఈ మాటకోసం ఇన్నాళ్లుగా వేచివుంది, నా మనసు ఎన్నో కలలే కంటుంది. దాని మనసే నీలో ఉందంది, ఆ ముద్దెదో నీకే ఇమ్మంది."""
Manassa,Romantic,2007,Haricharan,"""మనసా నువ్వుండే, చోటే చెప్పమ్మా, మనసే నీకేదో చెప్పాలందమ్మా. నిన్నా మొన్నా ఈ వైనం నాలో లేదమ్మా, ఈరోజేదో ఆనందం చంపేస్తుందమ్మా. మనసా నువ్వుండే, చోటే చెప్పమ్మా, మనసే నీకేదో చెప్పాలందమ్మా. నిన్నా మొన్నా ఈ వైనం నాలో లేదమ్మా, ఈరోజేదో ఆనందం చంపేస్తుందమ్మా. ఓ సోనా వెన్నెల సోనా, నేనంతా నువ్వయ్యానా, నీ రూపూ రేఖల్లోనా నేనుండీ వెలుగైపోనా. ఓ సోనా వెన్నెల సోనా, నీ వాలే కన్నులోనా, నా చిత్రం చిత్రించెయినా కనుపాపైపోనా. మనసా నువ్వుండే, చోటే చెప్పమ్మా, మనసే నీకేదో చెప్పాలందమ్మా. నిన్నా మొన్నా ఈ వైనం నాలో లేదమ్మా, ఈరోజేదో ఆనందం చంపేస్తుందమ్మా. నీవే తోడని నిజంగా, నీలో చేరితి క్రమంగా, నీవుంటే ఒక యుగమే అయిపోయే ఇక క్షణమే. తెలుసా తెలుసా ఇది తెలుసా, మార్చేసావే నా ఈ వరసా, నువ్వు మార్చేసావే నా ఈ వరసా. ఓ సోనా వెన్నెల సోనా, రేపావే అల్లరి చానా, చెక్కిల్లో చుక్కైపోనా, చూపుల్తో చుట్టేసెయ్ నా. ఓ సోనా వెన్నెల సోనా, ముంగిట్లో ముగ్గై రానా, ముద్దుల్తో ముంచేసెయ్ నా, కౌగిలికే రానా. మనసా నువ్వుండే, చోటే చెప్పమ్మా, మనసే నీకేదో చెప్పాలందమ్మా."
Naalone Pongenu Narmada,Romantic,2008,"V.V. Prassanna,Harish Raghavendra,Devan Ekambaram","""నాలోనే పొంగెను నర్మదా, నీళ్ళల్లో మురిసిన తామరా, అంతట్లో మారెను రుతువులా, పిల్లా నీవల్లా. నీతో పొంగే వెల్లువా, నీళ్ళల్లో ఈదిన తారకా, బంగారు పూవుల కానుకా, పేరేలే కాంచనా. ఓ శాంతి శాంతి ఓ శాంతి, నా ప్రాణం సర్వం నీవేలే, నా శ్వాసే నీవే దోచావే, చెలి నేనే నీవు అయ్యావే. ఏదో ఒకటి నన్ను కలచి, ముక్కు చివరా మర్మమొకటి, కల్లాకపటం కరిగిపోయే, ముసినవ్వా భోగమెల్లా. నువు నిలిచిన చోటేదో, వెల ఎంత పలికేనో, నువు నడిచే బాటంతా, మంచల్లే అయ్యేనో. నాతోటి రా ఇంటి వరకు, నా ఇల్లే చూసి నన్ను మెచ్చు. నీవు నిలిచిన చోటేదో, వెల ఎంత పలికేనో, నువు నడిచే బాటంతా, మంచల్లే అయ్యేనో. కంటి నిద్రే దోచు కెళ్ళావ్‌ దోచు కెళ్ళావ్‌, ఆశలన్నీ జల్లివెళ్ళావ్‌, నిన్ను దాటి పోతూ ఉంటే పోతూ ఉంటే, వీచే గాలి దిశలు మారు. ఆగంటు నీవంటే నాకాళ్ళే ఆగేనే, నీ తలలో పూలన్నీ వసివాడవు ఏనాడు, కౌగిలింతే కోరలేదు కోరితే కౌగిలి కాదు. నా జీవన సర్వం నీతోనే, నను తలచే నిమిషం ఇదియేనే, నువు లేవు లేవు అనుకుంటే, నా హృదయం తట్టుకోలేదే."""
Cheppave Chirugali,Romantic,2015,"Udit Narayan,Sujatha","""చెప్పవే చిరుగాలి, చల్లగా ఎద గిల్లి. చెప్పవే చిరుగాలి, చల్లగా ఎద గిల్లి. ఎక్కడే వసంతాల కేళి, ఓ చూపవే నీతో తీసుకెళ్లి. ఎక్కడే వసంతాల కేళి, చూపవే నీతో తీసుకెళ్లి. చెప్పవే చిరుగాలి, చల్లగా ఎద గిల్లి. ఎక్కడే వసంతాల కేళి, ఓ చూపవే నీతో తీసుకెళ్లి. ఎక్కడే వసంతాల కేళి, ఓ చూపవే నీతో తీసుకెళ్లి. ఆశ దీపికలై మెరిసే తారకలు, చూసే తీపి కలై విరిసే కోరికలు. మనతో జతై సాగుతుంటే, హో అడుగే అలై పొంగుతుంది. ఆ చుట్టూ ఇంకా రేయున్నా, అంతా కాంతే చూస్తున్నా. ఎక్కడ ఎక్కడ ఎక్కడ వేకువ అంటూ, రెక్కలు విప్పుకు ఎగిరే కళ్ళు. దిక్కులు తెంచుకు దూసుకుపోతూ ఉంటె, ఆపగలవ చీకట్లు. కురిసే సుగంధాల హోలీ, ఓ చూపదా వసంతాల కేళి. కురిసే సుగంధాల హోలీ, ఓ చూపదా వసంతాల కేళి. చెప్పవే చిరుగాలి, చల్లగా ఎద గిల్లి. యమునా తీరాలా కథ వినిపించేలా, రాధామాధవుల జత కనిపించేలా. పాడనీ వెన్నెల్లో ఈ వేళా, చెవిలో సన్నాయి రాగంలా. ఓ కలలే నిజమై అందేలా, ఊగే ఊహల ఉయ్యాల. లాహిరి లాహిరి లాహిరి తారంగాల, రాతిరి యేటిని ఈదే వేళా. జాజిరి జాజిరి జాజిరి జానపదంలా, పొద్దే పలకరించాలి. ఊపిరే ఉల్లాసంగా"
Nenu Nuvvantu,Romantic,2010,"Nadeesh,U.V.Jackey,Naresh Iyer","""నేను నువ్వంటూ వేరై వున్నా, నా కి వేళా నీలో నేన్నునట్టుగా, అనిపిస్తూ వుందే వింతగా, నాకోసం నేనే వెతికేంతగా. ఓ గర్ల్ నువ్వే లేకుంటే లీసెన్ గర్ల్ ఏమవుతానో, ని స్నేహని కావాలంటున్నానుగా, కాదంటే నా మీదొట్టుగా, ఏమైనా చేస్తా నమ్మేటుగా. ఒకసారి చూసి నే వలచాన, నన్ను వీడిపోదు ఏ మగువైన, ప్రేమిస్తానే ఎంతో గాడంగా, నా ప్రేమ లోతులో మునిగాక నువ్వు పైకి తేలవే సులభం గా, ప్రాణాలైనా ఇస్తావ్ ఏకంగా ఓ. నిజాయితీ ఉన్నోడిని నిజాలని అన్నోడిని, అబద్దమే రుచించని అబ్బాయిని, ఒకేఒక మంచోడిని, రొమాన్సుసు లో పిచ్చోడిని, పర్లేదు లే ఒప్పేసుకో సరేనని. ముసుగేసుకోదు ఏ నాడు, నా మనసే ఓ భామ, నను నన్ను గానే చూపిస్తూ, కాదన్నా పోరాడేయ్దే నా ప్రేమ ఓ. నువ్వే లేకుంటే ఏమవుతానో, ని స్నేహని కావాలంటున్నానుగా, కాదంటే నా మీదొట్టుగా, ఏమైనా చేస్తా నమ్మేటుగా. ఒకసారి చూసి నే వలచాన, నన్ను వీడిపోదు ఏ మగువైన, ప్రేమిస్తానే ఎంతో గాడంగా, నా ప్రేమ లోతులో మునిగాక నువ్వు పైకి తేలవే సులభం గా, ప్రాణాలైనా ఇస్తావ్ ఏకంగా ఓ."""
Netho Cheppana,Romantic,2005,"K.S. Chitra,S.P.Balasubramanyam","""నీతో చెప్పనా నీక్కూడా తెలిసిన నువ్వెంతగా రెచ్చిపోతే అంత సరదా తెలుసునా. గారం చేసిన నయగారం చూపిన కనికారమే కలుగుతోందే కష్టపడకే కాంచన. నేనే నేనుగా లేనే లేనుగా ఆ ఆ ఆ ఆ నా కన్నుల నిధే వెన్నెల ఓ ఓ ఓ. నీతో చెప్పనా నీక్కూడా తెలిసిన నువ్వెంతగా రెచ్చిపోతే అంత సరదా తెలుసునా. ఇంకొంచం అనుకున్న ఇకచాల్లే అన్నానా వదలమంటే ఏమితర్ధం వదిలి పొమ్మన. పనిమాల పైపైన పడతావేం పసికూన ముద్దు మీరుతున్న పంతం హద్దులోనే ఆపనా. మగువ మనసు తెలిసేనా మగజాతికి. మొగలి మొనలు తగిలేనా లేత సోయగానికి కూత దేనికి. గారం చేసిన నయగారం చూపిన కనికారమే కలుగుతోందే కష్టపడకే కాంచన. ఒదిగున్న ఒరలోన కదిలించకె కుర్రదానా కత్తి సాముతో ప్రమాదం పట్టు జారేనా. పెదవోపని పదునైన పరవాలేదనుకోనా కొత్త ప్రేమలో వినోదం నీకు నేను నేర్పన. సొంత సొగసు బరువేన సుకుమారికి. అంత బిరుసు పరువేన రాకుమారుడాన్టి నీ రాజసానికి. గారం చేసిన నయగారం చూపిన కనికారమే కలుగుతోందే కష్టపడకే కాంచన. నేనే నేనుగా లేనే లేనుగా ఆహ్ ఆహ్ ఆహ్ ఆహ్ నా కన్నుల నీదే వెన్నెల ఓ ఓ ఓ."""
Gundello Emundho,Romantic,2002,"Venu,Sumangali","""గుండెల్లొ ఏముందో కళ్ళళ్ళో తెలుస్తుంది, పెదవుల్లో ఈమౌనం నీ పేరే పిలుస్తోంది. నిలవదు కద హౄదయం నువు ఎదురుగ నిలబడితే, కదలదు కద సమయం నీ అలికిడి వినకుంటే. కలవరమో తుదివరమో తెలియని తరుణం ఇది. గుండెల్లొ ఏముందో కళ్ళళ్ళో తెలుస్తుంది, పెదవుల్లో ఈమౌనం నీ పేరే పిలుస్తోంది. మనస మనస మనస మనస మనస మనస, ఓ మనస ఓ మనస. పూవులో లేనిది నీ నవ్వులో ఉన్నది, నువ్వు ఇప్పుడన్నది నేనెప్పుడును విననిది. నిన్నిలా చూసి పయనించి వెన్నెలె చిన్నబోతోంది, కన్నులే దాటి కలలన్ని నిదురగా వచ్చి నట్టుంది. ఏమో ఇదంతా నిజంగా కలలాగె ఉంది. గుండెల్లొ ఏముందో కళ్ళళ్ళో తెలుస్తుంది, పెదవుల్లో ఈమౌనం నీ పేరే పిలుస్తోంది. ఎందుకో తెలియనీ కంగారు పడుతున్నదీ, యెక్కడ జరగనీ ఇంకేమికాదే ఇది. పరిమళం వెంట పయనించి పరుగు తడబాటు పడుతోంది, పరిణయం దాక నడిపించి పరిచయం తోడు కోరింది. దూరం తలోంచె ముహూర్తం ఇంకెపుడొస్తుంది."""
Nenu Nenuga ,Romantic,2002,Spb Charan,"""నేను నేనుగ లేనే నిన్న మొన్న లా, లేని పోని ఊహల్లో ఎమిటో ఇలా, ఉన్న పాటుగా ఏదో కొత్త జన్మలా, ఇప్పుడే ఇక్కడే పుట్టినట్టుగా. పూల చెట్టు ఊగినట్టూ పాల బొట్టు చిందినట్టు, అల్లుకుంది నా చుట్టు ఓ చిరు నవ్వు. తేనె పట్టు రేగినట్టు వీణమెట్టు ఒణికినట్టు, ఝల్లుమంది గుండెల్లో యెవరేనువ్వు. నా మనసుని మైమరపున ముంచిన ఆ వాన, మీకేవరికి కనిపించదు ఏమైనా ఓ హో హో ఓ. నేను నేనుగ లేనే నిన్న మొన్న లా, లేని పోని ఊహల్లో ఎమిటో ఇలా, ఉన్న పాటుగా ఏదో కొత్త జన్మలా, ఇప్పుడే ఇక్కడే పుట్టినట్టుగా. చుట్టుపక్కలెందరున్న గుర్తు పట్టలేక వున్న, అంత మంది ఒక్కలాగే కనబడతుంటే. తప్పు నాది కాదుఅన్న ఒప్పుకోరు ఒక్కరైన, చెప్పలేది నిజం ఏదో నాకు వింతే. కళ్ళ నొదిలెళ్ళను అని కమ్మిన మెరుపేదో, చెప్పవ కనురెప్పలకే మాటొస్తే ఓ హో హో ఓ."""
Nee Yadalo Naaku,Romantic,2010,"Yuvan Shankar Raja, Tanvi Shah","""నీ ఎదలో నాకు చోటే వద్దు, నా ఎదలో చేటే కోరవద్దు, మన ఎదలో ప్రేమను మాటే రద్దు, ఇవి పైపైన మాటలులే. నీ నీడై నడిచే ఆశ లేదే, నీ తోడై వచ్చే ద్యాస లేదే, నీ తోటే ప్రేమ పోతేపోనీ, అని అబద్దాలు చెప్పలేనులే. నీ జతలోన నీ జతలోన, ఈ ఎండకాలం నాకు వానాకాలం, నీ కలలోన నీ కలలోన, మది అలలాగ చేరు ప్రేమ తీరం. నీ ఎదలో నాకు చోటే వద్దు, నా ఎదలో చేటే కోరవద్దు, మన ఎదలో ప్రేమను మాటే రద్దు, ఇవి పైపైన మాటలులే. చిరుగాలి తరగంటి నీమాటకే, ఎద పొంగేను ఒక వెల్లువై, చిగురాకు రాగాల నీ పాటకే, తనువూగేను తొలిపల్లవై, ప్రేమ పుట్టాక నాకళ్ళలో, దొంగచూపేదో పురివిప్పెనే, కొంచెం నటనున్నది, కొంచెం నిజమున్నది. ఈ సయ్యాట బాగున్నది, నువ్వల వేస్తే నువ్వల వేస్తే, నా ఎద మారే నా కథ మారే, అరె ఇది ఏదో ఒక కొత్త దాహం, అది పెరుగుతుంటే వీచే చెలి స్నేహం. ఒకసారి మౌనంగా నను చూడవే, ఈ నిమిషమే యుగమౌనులే, నీ కళ్ళలో నన్ను బందించవే, ఆ చెర నాకు సుఖమౌనులే. నిన్ను చూసేటి నా చూపులో, కరిగే ఎన్నెన్ని మునిమాపులో, పసిపాపై ఇలా నా కనుపాపలే, నీ జాడల్లో దోగాడెనే. తొలి సందెలలో తొలి సందెలలో, ఎరుపే కాదా నీకు సింధూర"
Subhalekha,Romantic,1990,S. P. Balasubrahmanyam,"""శుభలేఖ రాసుకున్న యెదలో ఎపుడో, అది నీకు పంపుకున్న అపుడే కలలో. పుష్యమి పూవులా పూజ చేస్తా బుగ్గన చుక్కలతో, ఒత్తిడి వలపుల గంధమిస్తా పక్కలలో. శుభలేఖ అందుకున్న కలయో నిజమో, తోలి ముద్దు జాబు రాసా చెలికె ఎపుడో. శారద మల్లెల పూల జల్లే వెన్నెల నవ్వులలో, శ్రావణ సంధ్యను రంగరిస్తా కన్నులతో. శుభ లేఖ రాసుకున్న యెదలో ఎపుడో, తోలి ముద్దు జాబు రాసా చెలికె ఎపుడో. చైత్రమాసమోచెనేమో చిత్రమైన ప్రేమకి, కోయిలమ్మ కూసేనేమో గొంతునిచ్చి కొమ్మకి. మత్తుగాలి వీచెనేమో మాయదారి చూపుకి, మల్లెమబ్బులాడెనేమో బాల నీలవేణికి. మెచ్చి మెచ్చి చూడసాగె గుచ్చే కన్నులు, గుచి గుచి కౌగిలించే నచ్చే వన్నెలు. అంతేలే కదంతేలే అదంతేలే, శుభలేఖ అందుకున్న కలయో నిజమో. హంసలేఖ పంపలేక హింసపడ్డ ప్రేమకి, ప్రేమలేఖ రాసుకున్న పెదవి రాణి మాటకు. రాధా లాగ మూగబోయా పొన్న చెట్టు నీడలో, వేసవల్లే వేచి ఉన్న వేగు పూల తోటలో. వాలు చూపు మోసుకొచ్చే ఎన్నో వార్తలు, వొళ్ళో దాటి వెళ్లసాగే ఎన్నో వాంఛలు. అంతేలే కదంతేలే అదంతేలే, శుభలేఖ రాసుకున్న యెదలో ఎపుడో, అది నీకు పంపుకున్న అపు"
